{
  "gate_id": "pre_publish",
  "validator": "aggregate",
  "status": "pass",
  "blocking": true,
  "checked_files": [
    "sources/source-pack.md",
    "validation/post-research.json",
    "draft.md",
    "validation/post-plan.json",
    "validation/post-request.json",
    "validation/post-review.json",
    "publish.md",
    "validation/post-draft.json"
  ],
  "errors": [],
  "warnings": [
    "task_type=primitive，非 decision 类型跳过"
  ],
  "rule_refs": [
    "harness/rules/research/traceability-rules.md",
    "harness/rules/research/decision-criteria-rules.md",
    "harness/rules/artifacts/publish-rules.md",
    "harness/gates/registry.yaml"
  ],
  "metadata": {
    "aggregated_from": 4
  }
}