{
  "gate_id": "post_plan",
  "validator": "aggregate",
  "status": "pass",
  "blocking": true,
  "checked_files": [
    "plan.md",
    "request.md",
    "change.yaml"
  ],
  "errors": [],
  "warnings": [],
  "rule_refs": [
    "harness/rules/artifacts/plan-rules.md"
  ],
  "metadata": {
    "aggregated_from": 4
  }
}