{
  "gate_id": "post_research",
  "validator": "aggregate",
  "status": "warn",
  "blocking": false,
  "checked_files": [
    "sources/source-pack.md",
    "sources/evidence-map.md"
  ],
  "errors": [],
  "warnings": [
    "[advisory] sources/evidence-map.md not found"
  ],
  "rule_refs": [
    "harness/rules/artifacts/source-pack-rules.md",
    "harness/rules/research/traceability-rules.md",
    "harness/rules/artifacts/evidence-map-rules.md"
  ],
  "metadata": {
    "aggregated_from": 3
  }
}