{
  "gate_id": "post_draft",
  "validator": "aggregate",
  "status": "pass",
  "blocking": true,
  "checked_files": [
    "publish.md",
    "sources/source-pack.md",
    "draft.md"
  ],
  "errors": [],
  "warnings": [
    "PASS: draft.md has required structure",
    "blocks=0"
  ],
  "rule_refs": [
    "harness/rules/diagrams/diagram-policy.md",
    "harness/rules/artifacts/draft-rules.md",
    "harness/rules/research/traceability-rules.md"
  ],
  "metadata": {
    "aggregated_from": 4
  }
}